{
  "$schema": "./schemas/test-budget.schema.json",
  "schemaVersion": 1,
  "description": "Test layers and their wall-clock budgets. Run with `node .github/eos/run-tests.mjs`. A layer is a set of files that run in ONE `node --test` invocation, so Node parallelises them across cores. budgetMs is the ABSOLUTE ceiling everywhere, calibrated against the CI runner that enforces it (about 1.8x its observed time): the first budgets were set from a 16-core laptop, so on the 2-core runner audit-regression already sat at 95%. Slow creep below the ceiling is the job of the per-environment baseline (EOS_TEST_BASELINE_ENV, baselineTolerance). On a slow runner set EOS_TEST_BUDGET_SCALE instead of raising a budget, so the ratio a breach represents stays the same everywhere. Runner speed varies as much as the drift tolerance: the same commit (2daa3e3) took 20.6s and 31.2s for integration on two ubuntu-latest runs, every file scaled alike. So the ci-linux baselines are recorded from the slower runner class (eos-2.0.0: integration grew by four suites — first run, release signing, policy upstream, governance report), and each budget stays about 1.8x of it. eos-2.2.0/2.3.0 re-recorded integration, contract and audit-regression: six integration suites were added since 2.0.0 (JUnit evidence, skills, agent platforms, brownfield, stage init, MCP stop), the MCP contract suite, and the eval-starter replay cases; the slower runner class then measured integration 52.9s, contract 16.7s, and audit-regression 38.5s at most (its audit step was skipped after the integration step failed on drift), while a fast runner took 32.4s / 11.8s / 26.4s for the same commit.",
  "defaultScale": 1,
  "testTimeoutMs": 120000,
  "layerTimeoutMs": 900000,
  "coverageTimeoutMs": 1800000,
  "baselineTolerance": 0.5,
  "baselines": {
    "ci-linux": {
      "audit-regression": 38500,
      "contract": 16800,
      "integration": 53000,
      "journey": 4200,
      "unit": 9000
    }
  },
  "coverage": {
    "description": "Thresholds for `run-tests.mjs --coverage`. Set just below the measured figure (lines 96.9 / branches 75.8 / functions 96.3 at the time of writing) so they catch a real regression rather than chasing a round number. Enforced natively by Node 22+; on Node 20 the report still prints but the threshold is not applied, and run-tests says so rather than implying it passed.",
    "lines": 95,
    "branches": 73,
    "functions": 94,
    "exclude": [
      "**/*.test.mjs",
      "**/test-support.mjs",
      "**/audit-support.mjs",
      "**/journey.demo.mjs",
      "**/run-tests.mjs"
    ]
  },
  "layers": {
    "unit": {
      "description": "Pure logic and single-module behaviour. No repository fixtures beyond a temp dir.",
      "budgetMs": 15000,
      "files": [
        ".github/eos/alignment.test.mjs",
        ".github/eos/release-workflow.test.mjs",
        ".github/eos/atomic.test.mjs",
        ".github/eos/junit.test.mjs",
        ".github/eos/migrate.test.mjs",
        ".github/eos/packs.test.mjs",
        ".github/eos/state-model.test.mjs",
        ".github/eos/test-hygiene.test.mjs",
        ".github/eos/workspace-rule.test.mjs",
        ".github/hooks/check-doc-parity.test.mjs",
        ".github/hooks/deny-dangerous.test.mjs",
        ".github/hooks/secret-rules.test.mjs",
        ".github/hooks/spec-align.test.mjs"
      ]
    },
    "contract": {
      "description": "Published interfaces: the CLI's JSON contract and exit codes, the provider-adapter contract, and the offline boundary that both rest on.",
      "budgetMs": 30000,
      "files": [
        ".github/eos/cli.test.mjs",
        ".github/eos/adapters.test.mjs",
        ".github/eos/diagnostic-contract.test.mjs",
        ".github/eos/mcp.test.mjs",
        ".github/eos/offline-boundary.test.mjs",
        ".github/eos/schema-matrix.test.mjs",
        ".github/hooks/validate-config.test.mjs"
      ]
    },
    "integration": {
      "description": "Several modules together through real fixtures: routing decisions, gate bypasses, cross-stack quality.",
      "budgetMs": 95000,
      "files": [
        ".github/eos/agent-platforms.test.mjs",
        ".github/eos/bypass.test.mjs",
        ".github/eos/cross-branch.test.mjs",
        ".github/eos/first-run.test.mjs",
        ".github/eos/release-signing.test.mjs",
        ".github/eos/policy-upstream.test.mjs",
        ".github/eos/report.test.mjs",
        ".github/eos/incremental.test.mjs",
        ".github/eos/ledger-merge.test.mjs",
        ".github/eos/policy.test.mjs",
        ".github/eos/router.test.mjs",
        ".github/eos/skills.test.mjs",
        ".github/eos/stage-init.test.mjs",
        ".github/eos/test-evidence.test.mjs",
        ".github/eos/transaction.test.mjs",
        ".github/eos/upgrade.test.mjs",
        ".github/hooks/eos-doctor.test.mjs",
        ".github/hooks/project-gate.test.mjs"
      ]
    },
    "journey": {
      "description": "The whole developer loop end to end, executed through the real CLI, offline.",
      "budgetMs": 10000,
      "files": [
        ".github/eos/journey.test.mjs"
      ]
    },
    "audit-regression": {
      "description": "One executable case per audit finding. Each test performs the reported bypass, then asserts it no longer works. A failure here means an audit finding has re-opened.",
      "budgetMs": 70000,
      "files": [
        ".github/eos/audit-evidence.test.mjs",
        ".github/eos/audit-examples.test.mjs",
        ".github/eos/audit-gates.test.mjs",
        ".github/eos/audit-release.test.mjs",
        ".github/eos/audit-review.test.mjs",
        ".github/eos/audit-robustness.test.mjs",
        ".github/eos/audit-secrets.test.mjs"
      ]
    }
  }
}
